,program,day,month,year,title,author,key_words,abstract,resume
0,mestrado,26,Nov,2012,Atletas paraolímpicos do Rio Grande do Norte,"Amorim, João Batista de",Pessoa com deficiência;Envergadura;Força;Halterofilismo;Paraolímpico;Ativação mioelétrica,"The aim of this study is focus on the relation between wingspan and myoelectric
activation of serratus anterior, brachial triceps, brachial biceps, deltoid anterior and
pectoralis major muscles in different intensity, of supine in the para-athletes. It is
descriptive cross section, investigative typology and randomized comparative study.
The individuals investigated were 17 para-athletes men and all of categories in the
population of 55 participants of Circuito Caixa de Halterofilismo Paraolímpico carried
out in Natal, Rio Grande do Norte, 2011. It was made a test of 50% with a break of 4
minutes and it was repeated with a heavier load in the competition (considered
100%). The wingspan measure was carried out according to the protocol of
PROESP-BRA. The electromyography was carried out in the deltoid anterior, triceps,
biceps, serratus anterior and pectoralis major muscles, where was verified the
analisys by the RMS value, that is, squaring the data obtained in percentage.
According to the results, analysis of variance (ANOVA) was applied to compare the
activation between the muscles analyzed with 50% and 100%. The Pearson relation
was used to verify the existence of relationship between the wingspan and muscles
activation. The results revealed that the pectoralis major muscle obtained the higher
activation in both study 50% as 100%, the deltoid anterior showed as the lower
activation when the exercise was carried out with 50%, the biceps brachial low
activated with 100% and serratus anterior presented with high interval of confidence
(IC95) with the execution of supine in both intensities. Based on the results, it
concluded that is a relation of cause and affect between the wingspan and
myoelectric activation in the muscles studied to the population investigated,
evidencing the importance of wingspan as a natural selection criteria in para-athletes
of supine.","O objetivo deste estudo centra-se na relação entre envergadura e ativação
mioelétrica dos músculos serrátil anterior, tríceps braquial, bíceps braquial, deltoide
anterior e peitoral maior em diferentes intensidades, do levantamento supino em
para-atletas. Trata-se de um estudo transversal de cunho descritivo, tipologia
investigativa e delineamento comparativo. Os indivíduos investigados foram 17 paraatletas do sexo masculino e de todas as categorias de uma população de 55
participantes do Circuito Caixa de Halterofilismo Paraolímpico realizado em Natal,
Rio Grande do Norte, no ano de 2011. Foi realizado um teste a 50% dado um
intervalo de 4 minutos e repetiu-se o teste com a maior carga levantada na
competição (considerada 100%). A medida de envergadura foi realizada pelo
protocolo da PROESP-BRA. A eletromiografia foi realizada nos músculos deltoide
anterior, tríceps, bíceps, serrátil anterior e peitoral maior, sendo verificado a análise
pelo valor do RMS, ou seja, a elevação ao quadrado dos dados obtidos em
porcentagem. A partir dos resultados, foi utilizada a Análise de Variância (ANOVA)
para comparar as ativações entre as musculaturas analisadas a 50% e 100%. Foi
utilizada também a correlação de Pearson, para verificar a existência de relação
entre a envergadura e ativação muscular. Os resultados encontrados revelaram que
o músculo peitoral maior obteve a maior ativação tanto a 50% quanto a 100%, o
deltoide anterior apresentou-se como o de menor ativação quando o exercício foi
realizado a 50%, o bíceps braquial menos ativado a 100% e o serrátil anterior
apresentou-se com um alto intervalo de confiança (IC95) na execução do supino nas
duas intensidades. Baseado nos achados do estudo, conclui-se que há relação de
causa e efeito entre a envergadura e ativação mioelétrica na musculatura
investigada para o grupo amostral, evidenciando a importância da envergadura
como critério de seleção natural à para-atletas de levantamento supino."
1,mestrado,21,Dec,2018,Atividade anticoagulante in vitro de galactanas sulfatadas obtidas da alga verde Udota flabellum (J.Ellis & Solander) M.Howe,"Marques, Maxsuell Lucas Mendes",Algas marinhas tropicais;Polissacarídeos sulfatados;Anti-IIa,"The main known anticoagulant drug is the sulfated polysaccharide named
heparin. However, the use of heparin can cause side effects such as the development
of thrombocytopenia, arterial embolism, bleeding complications. Therefore, new
anticoagulants that have fewer side effects than heparin are being sought. Many
seaweeds are known to synthesize sulfated polysaccharides with anticoagulant
activity. Therefore, in this paper, sulfated polysaccharide-rich extracts were obtained
from 22 tropical seaweeds (4 red, 11 brown, and 7 green) found in northeastern Brazil
and evaluated as anticoagulant agents. Fifteen extracts had anticoagulant activity,
including all extracts of green seaweeds. Udotea flabellum extract was the most
potent, requiring only 3 µg to double the plasma coagulation time in the activated
partial thromboplastin time (APTT) test. A similar result was obtained with 1 µg of
heparin. Two sulfated homogalactans F-I (130 kDa) and F-II (75 kDa) with high
anticoagulant activity were obtained from this extract using several bio-guided
purification steps. Their anticoagulant activities were close to that of heparin. F-I and
F-II (0.5–10 μg/mL) were not able to directly inhibit thrombin. In the presence of
antithrombin, F-I (0.5 μg/mL) was more effective than heparin (0.5 μg/mL) in inhibiting
thrombin, while F-II showed similar effects as heparin. Taken together, the results
provide strong evidence for the anticoagulant potential of sulfated homogalactans
from U. flabellum.","O principal fármaco anticoagulante conhecido é o polissacarídeo sulfatado
conhecido como heparina. No entanto, o uso contínuo da heparina pode causar
efeitos colaterais, como o desenvolvimento de trombocitopenia, embolia arterial e
complicações hemorrágicas. Portanto, há uma busca por novos anticoagulantes que
tenham menos efeitos colaterais do que a heparina. Muitas algas sintetizam
polissacarídeos sulfatados com atividade anticoagulante. Por isso, neste trabalho,
extratos ricos em polissacarídeos sulfatados, e que ainda não foram avaliados como
anticoagulantes, foram obtidos de 22 algas tropicais (4 vermelhas, 11 marrons e 7
verdes) encontradas no nordeste do Brasil e avaliadas como agentes anticoagulantes.
Quinze extratos apresentaram atividade anticoagulante, incluindo todos os extratos
de algas verdes. O extrato da alga verde Udotea flabellum foi o mais potente,
necessitando apenas de 3 µg para dobrar o tempo de coagulação plasmática no teste
do tempo de tromboplastina parcial ativada (TTPA). Resultado semelhante foi obtido
com 1 µg de heparina. Duas homogalactanas sulfatadas denominadas de F-I (130
kDa) e F-II (75 kDa) com alta atividade anticoagulante foram obtidos a partir deste
extrato com o uso de diferentes etapas de purificação bioguiadas. Suas atividades
anticoagulantes estavam próximas às da heparina. F-I e F-II (0,5-10 µg/mL) não foram
capazes de inibir diretamente a trombina. Porém, na presença de antitrombina, a F-I
(0,5 μg/mL) foi mais eficaz que a heparina (0,5 μg/mL) na inibição da trombina,
enquanto a F-II apresentou efeitos similares à heparina. Em conjunto, os resultados
fornecem fortes evidências para o potencial anticoagulante dos homogalactanas
sulfatados de U. flabellum."
2,mestrado,20,Dec,2018,"Avaliação da prevalência, fatores de virulência e susceptibilidade antifúngica de Candida spp. oriundas de fezes de pombos (Columbia livia)","Pinto, Luciana Magalhães",Candida spp.;Fatores de virulência;Resistência antifúngica;Fezes de pombos;Columbia livia,,"Embora seja amplamente conhecido que Cryptococcus spp. podem transmitir
criptococose através de aerossol formado quando fezes secas (principalmente
de pombos) são dispersadas e aerotransportadas, pouco se sabe sobre o papel
dessas aves em abrigar outras leveduras patogênicas em seu trato
gastrointestinal, penas e bicos, especificamente porque esses animais
frequentemente permanecem e reproduzem-se próximas ou mesmo acima de
unidades de condicionadores de ar. Avaliou-se a prevalência de leveduras
patogênicas isoladas de fezes de pombos coletadas na área externa de um
hospital universitário no Brasil. Nosso objetivo foi também investigar o potencial
patogênico e a susceptibilidade antifúngica de espécies de Candida de interesse
médico isoladas dessas amostras. Portanto, foi realizada a avaliação da
expressão de atributos de fatores de virulência in vitro, incluindo a capacidade
de aderir às células epiteliais bucais humanas e a formação de biofilme e
produzir enzimas líticas, como fosfolipases, proteinases e hemolisinas. Testes
de sensibilidade antifúngica frente a fluconazol, itraconazol, anfotericina e
micafungina também foram realizados. O gênero Candida foi o mais prevalente
em nosso estudo, com várias espécies clinicamente importantes sendo isoladas.
Vale ressaltar que essas cepas foram capazes de expressar vários fatores de
virulência, mostrando claramente seu potencial patogênico. Esse estudo foi
capaz de demonstrar que Candida spp. isoladas de excrementos de pombos
podem expressar fatores de virulência da mesma forma de isolados clínicos,
sugerindo um potencial patogênico para estas leveduras. O fato de essas cepas
terem sido coletadas da área externa de um hospital terciário apresenta potencial
interesse, porque elas podem ser uma fonte de infecção, especificamente para
hospedeiros imunocomprometidos."
3,mestrado,10,Jun,2015,"Análise das características clínicas, hematológicas e do perfil de expressão antigênica de pacientes com leucemia mielóide aguda do estado do Rio Grande do Norte","Freire, Juliana Mendonça",Leucemia Mielóide Aguda;Imunofenotipagem;Citometria de fluxo,,"As leucemias agudas são um grupo heterogêneo de doenças hematológicas,
cujo diagnóstico se baseia na análise dos aspectos citomorfológicos e
imunofenotípicos permitindo identificar a linhagem hematopoiética de origem,
aspecto de grande relevância para o diagnóstico e tratamento destas
patologias. O objetivo deste trabalho foi Investigar um grupo de pacientes com
Leucemia Mielóide Aguda, baseado em critérios citomorfológicos e
imunofenotípicos através da citometria de fluxo. Os pacientes assinaram o
TCLE e suas amostras foram submetidas a análise hematológica,
citomorfológica e imunofenotípica. Utilizou-se painel de anticorpos monoclonais
a fim de diferenciar as leucemias linfoides e mieloides agudas, assim como
classificar os subtipos de LMA. Dos 338 investigados, 182(53.8%) eram do
sexo masculino e 156(46.2%) do sexo feminino. A idade variou de 1 a 90 anos.
A manifestação clínica mais frequente foi a esplenomegalia com 270(79.9%)
pacientes. Com relação aos dados laboratoriais, 204(60.3%) apresentaram
leucometria acima de 50.000/mm3 e em 302(89.3%) a contagem de plaquetas
mostrou-se abaixo de 100.000/L. Sobre a classificação FAB, o subtipo LMA-M1
foi mais presente, com 110(32.5%) casos. O marcador linfoide mais presente
foi o CD7 em 34(10.06%) dos pacientes. A análise da incidência mundial dos
subtipos de leucemia mostrou variações significativas em relação com a
distribuição geográfica, sexo e idade, sugerindo que existem vários fatores
etiológicos. Através desses dados foi possível caracterizar os subtipos de LMA
e correlacionar com dados clínicos e laboratoriais, a fim de proporcionar um
melhor tratamento bem como a monitorização dessa neoplasia."
4,mestrado,31,Oct,2016,Incidência de pré-eclâmpsia no Rio Grande do Norte e fatores de risco,"Barreto, Sônia Maria de Medeiros",Epidemiologia;Síndrome HELLP;Pré-eclâmpsia;Imunologia;Citocinas;Brasil,"Hypertensive disorders of pregnancy are a group of illnesses that have high morbidity
and mortality, both for the mother and the fetus. Environmental factors such as weight
gain during pregnancy and infections appear to be associated with an increased risk of
developing those diseases. Women more lower socioeconomic level have a higher risk
of hypertensive disorders and their complications, including higher mortality. This study
aimed to evaluate the incidence of hypertensive disorders of pregnancy (pre-eclampsia
and eclampsia) in Brazil and in the state of Rio Grande do Norte, considering a time
series, and to evaluate risk factors for disease, considering data from a reference center
for high-risk pregnancy. Data were collected from the DATASUS from 2008 to 2014. The
data of the reference service (Maternity Hospital Januário Cicco in Natal) were obtained
for the period 2001 to 2014. The data for risk factors family were obtained through
interviews with pregnant women. The incidence of hypertensive disorders of pregnancy
was 3.9% for Brazil, while for the State of Rio Grande do Norte was 9.5% (p <0.05). In
turn, the incidence of eclampsia was 0.4% in Brazil and 1.0% in the state of Rio Grande
do Norte (p<0.05). The incidence of eclampsia has remained stationary in Brazil as a
whole (p=0.560), and the state of Rio Grande do Norte, despite the magnesium sulfate
use. Mortality due to hypertensive disease in Brazil was 0.48%, while mortality from
eclampsia was 2.4%. Risk factors for preeclampsia in the state of Rio Grande do Norte
included higher body mass index and maternal history of hypertension and
preeclampsia. Family history of hypertension and pre-eclampsia indicates a genetic
trend associated with risk of disease. In summary, hypertensive disorders of pregnancy
remain an important health problem with implications for both women and children born
of a preeclampsia pregnancy. There are preventable factors such as lower body mass
index prior to pregnancy, weight control during pregnancy and better quality of the diet
that decrease risk of hypertensive disorders of pregnancy and-or their complications.","As doenças hipertensivas da gravidez são um grupo de afecções que têm alta
morbimortalidade, tanto materna quanto fetal. Fatores ambientais como aumento de
peso e infecções durante a gravidez parecem estar associados a um risco maior de
desenvolver essas doenças. Mulheres com nível sócio econômico mais vulnerável
apresentam risco maior de doença e de complicações, incluindo maior mortalidade.
Este estudo teve como objetivos avaliar a incidência das doenças hipertensivas da
gravidez (pré-eclâmpsia e eclâmpsia) no Brasil e no estado do Rio Grande do Norte,
considerando uma série temporal, e avaliar fatores de risco associados para
desenvolver estas doenças, considerando dados de centro de referência para gestação
de alto risco. Os dados foram coletados do DATASUS no período de 2008 a 2014. Os
dados do serviço de referência em doença hipertensiva da gravidez (Maternidade
Escola Januário Cicco, em Natal) foram obtidos para o período de 2008 a 2014. Os
dados referentes a fatores de risco familiar foram obtidos via entrevistas com as
gestantes. As doenças hipertensivas da gravidez são mais frequentes no nordeste do
Brasil. A incidência de doença hipertensiva da gravidez foi de 3,9% para o Brasil,
enquanto para o Estado do Rio Grande do Norte foi de 9,5% (p<0,05). Por sua vez, a
incidência de eclâmpsia foi de 0,4% no Brasil e 1,0% no estado do Rio Grande do Norte
(p<0,05). A incidência de eclâmpsia tem se mantido estacionária no Brasil, como um
todo, e no estado do Rio Grande do Norte, apesar do uso de sulfato de magnésio. A
mortalidade por doença hipertensiva no Brasil foi de 0,48% dos casos, enquanto a
mortalidade por eclâmpsia foi de 2,4%. Em resumo, a doença hipertensiva permanece
como problema importante. Existem fatores preveníveis como menor índice de massa
corpórea ao engravidar, controle de peso durante a gestação e melhor qualidade de
dieta que podem influenciar, minimizando o risco da doença hipertensiva da gravidez e ou suas complicações."
5,mestrado,19,Nov,2018,Emulsão bucal de óleo de rã-touro (Rana catesbeiana Shaw): um potencial sistema mucoadesivo para o tratamento de candidíase oral,"Silva, Susiane de Santana Moreira Oliveira da",Atividade antifúngica;Biocompatibilidade;Emulsão bucal;Óleo de rã-touro;Propriedades mucoadesivas,"Oral candidiasis (OC) is an infectious disease caused by microorganisms of the
genus Candida, leading to lesions in the buccal cavity. Its treatment consists on the
administration of topical or systemic antifungal agents, which may compromise the
patient compliance due to its side effects, highlighting the need for alternatives of
treatments able to remove this infection and to avoid the side effects of the current
treatment. In this scenario, the bullfrog oil, an animal oil composed by a pool of
saturated and unsaturated fatty acids, is introduced as a potential antifungal raw
material. Thus, the aim of this work was to produce a mucoadhesive emulsified
system able to deliver the bullfrog oil in the buccal cavity to treat the OC. The
emulsion was produced and characterized by visual inspection, droplet size,
polydispersity index (PdI) and zeta potential and its stability was assayed over 60
days. In addition, its mucoadhesive ability was evaluated using an in vitro mucin
model. The antifungal activity by broth microdilution assay and biocompatibility
against human erythrocytes were also performed. The emulsion showed droplet size
of 320.79 ± 35.60 nm, PdI of 0.49 ± 0.08 and zeta potential of -38.53 ± 6.23 mV,
which showed no significant changes over 60 days. The mucoadhesive properties of
the system were improved by the use of pharmaceutical excipients and the antifungal
activity showed that the bullfrog oil and the emulsion were able to inhibit the growth of
different Candida species. Furthermore, the emulsion showed no significant
hemolytic effect. Overall, the system showed suitable physicochemical characteristics
and biocompatibility, with substantial in vitro antifungal activity, suggesting that this
emulsion can be further investigated for OC treatment.","Candidíase oral (CO) é uma doença infecciosa causada por microrganismos do
gênero Cândida e que tem por característica a presença de lesões na cavidade
bucal. Seu tratamento consiste na administração de antifúngicos tópicos ou
sistêmicos, os quais podem ter sua efetividade comprometida em virtude da baixa
adesão ao tratamento causada por seus efeitos adversos, o que evidencia a
necessidade de novas alternativas de tratamento capazes de tratar tal infecção e
evitar os efeitos colaterais do tratamento atual. Nesse cenário, surge o óleo de rãtouro, um óleo animal composto por um conjunto de ácidos graxos saturados e
insaturados, e que já demonstrou em estudos anteriores ser uma potencial matériaprima antifúngica. Assim, o objetivo deste trabalho foi produzir um sistema
emulsionado com características mucoadesivas capaz de veicular o óleo de rã-touro
na cavidade bucal para tratar a CO. A emulsão foi produzida e caracterizada por
inspeção visual, tamanho hidrodinâmico de gotícula, índice de polidispersão (PdI) e
por potencial zeta e sua estabilidade foi avaliada por um período de 60 dias. Além
disso, as características mucoadesivas foram avaliadas in vitro através de um
modelo de mucina. A atividade antifúngica foi investigada por ensaio de
microdiluição em caldo e a biocompatibilidade frente à eritrócitos humanos também
foi avaliada. A emulsão apresentou tamanho de gotícula de 320,79 ± 35,60 nm, PdI
de 0,49 ± 0,08 e potencial zeta de -38,53 ± 6,23 mV, que não apresentaram
alterações significativas ao longo de 60 dias. As propriedades mucoadesivas do
sistema foram melhoradas pelo uso de excipientes farmacêuticos e a atividade
antifúngica evidenciou que o óleo de rã-touro e a emulsão foram capazes de inibir o
crescimento de diferentes espécies de Cândida. Além disso, a emulsão não mostrou
efeito hemolítico significativo. Finalmente, o sistema apresentou características
físico-químicas e biocompatibilidade adequadas, com considerável atividade
antifúngica in vitro, sugerindo que essa emulsão pode ser mais amplamente
investigada para o tratamento da CO."
