,program,day,month,year,title,author,key_words,abstract,resume
143,mestrado,6,Nov,2009,"Estado nutricional, desempenho motor e marcadores dermatoglíficos em escolares púberes","Pinto, Edson Fonseca",Avaliação física;Índice de massa corporal;Maturação sexual;Saúde,,"A fase da puberdade é o período em que ocorrem as maiores transformações características da adolescência. Por essa razão, este estudo objetivou identificar o estado nutricional, desempenho motor e marcadores dermatoglíficos em 2363 escolares púberes selecionados de forma estratificada, de ambos os sexos, com idades variando de 6 a 15 anos, matriculados no Ensino Fundamental (2ª a 9ª Séries) do ensino público no estado do Rio Grande do Norte. Foram avaliados o estado nutricional (Índice de Massa Corporal); as qualidades físicas básicas ( testes de coordenação, equilíbrio, agilidade, flexibilidade, força e velocidade); o potencial genético (método da dermatoglifia) e o estágio maturacional (auto avaliação de Tanner); Com relação ao estado nutricional observou-se que escolares acima do peso apresentam valores mais baixos em relação ao seu desempenho motor sendo esses valores, mais significativos nos meninos. No que se refere à maturação sexual, os resultados apontaram que os meninos atingem os estágios maturacionais primeiro que as meninas, não tendo encontrado correlação entre o potencial genético e os demais indicadores o que nos permite concluir que os escolares do estado do Rio Grande do Norte, principalmente os do sexo masculino sofrem influência significativa de seu estado nutricional e seu estágio maturacional no que diz respeito ao seu desempenho motor. Essa dissertação apresenta relação de interdisciplinaridade, tendo o seu conteúdo uma aplicação nos campos da Educação Física, Nutrição, Medicina e Enfermagem."
144,mestrado,26,Aug,2009,"Dípteros (Culicidae) transmissores de arbovírus em área de
proteção ambiental urbana (Parque das Dunas Natal-RN,) 2004-2006","Medeiros, Arlinete Souza de",Ae;Albopictus;Hg;Leucocelaenus;Oc;Scapularis;Sazonalidade;Ovitrampas;Bambu,,"Desenvolvido no Parque das Dunas, segunda reserva ambiental urbana do Brasil, ocupando uma área de 1.172,80 hectares, com característica de mata atlântica de dunas, situada numa faixa litorânea na região urbana do município de Natal (05° 46  S, 35º 12  W), o presente estudo, realizado durante os anos de 2004 a 2006, teve como objetivo identificar as espécies de culicídeos existentes no Parque das Dunas, capazes de transmitir arbovírus, tendo em vista que em 2004 houve uma epizootia de saguis (Callitrix jacchus), que causou grande mortandade, sem definição do agente etiológico. No ano de 2004, foram pesquisados sete pontos no interior da mata, com instalação de 20 armadilhas de ovitrampas e 20 de bambu para coleta dos imaturos. Para os adultos, durante quatro vezes por semana, foram usadas as armadilhas de Sannhon. Foram coletados 5.691 imaturos, sendo 839 Ae. aegypti, 3.184 Ae. albopictus e 1.668 Hg. leucocelaenus. A coleta dos adultos foi realizada de
2004 a 2006, etapa em que se recolheu 17.506 culicídeos adultos, sendo 17.244 Wy. bourrouli, 255 Ae. aegypti, 593 Ae. albopictus, 1.275 Hg. leucocelaenus, 294 Oc. scapularis, 05 Oc. taeniorynchus, 02 Oc. serratus e 3 Li. durhami. Para os imaturos houve correlação significativa entre Ae. aegypti e umidade relativa do ar p = 0, 049 e pluviometria p = 0,00, Ae. albopictus apresentou correlação significativa positiva com a pluviometria, enquanto Hg. leucocelaenus não apresentou nenhuma das variáveis climáticas. Para os adultos, a análise de série temporal aponta flutuação sazonal significativa para
Ae. aegypti (p = 0,003); Ae. albopictus (p = 0,04); Oc. scapularis (p = 0,008 ) e Hg. leucocelaenus (p = 0,003). Uma correlação significativa negativa foi observada entre o número de Ae. albopictus coletado e a temperatura (Corr= - 0,50, p = 0,01); isto é, para cada 1°C a mais há diminuição de 7 espécimes. Este estudo teve a participação de uma equipe multidisciplinar: biólogos,
entomologistas, para confirmação das espécies; técnicos de laboratório, para acompanhamento diário das larvas eclodidas das armadilhas de ovitrampas. Teve a importante colaboração de profissionais da Fundação Oswaldo Cruz   FIOCRUZ/Rio de Janeiro, da Universidade de São Paulo   USP para identificação do grupo Wyeomyia."
145,mestrado,7,Aug,2009,Aspectos ambientais e sociais envolvidos na transmissão da L. chagasi no município de Parnamirim/RN,"Lima, Iraci Duarte de","Leishmania chagasi;Leishmaniose;DTH;Leishmaniose
visceral canina;Anticorpo;Lu;longipalpis;Leishmania chagasi;Leishmaniasis;DTH;Antibody;Canine visceral leishmaniasis;Lu;longipalpis","Visceral leishmaniasis hás adapted in the past 20 years to periurban and urban areas, and in Natal, Rio Grande do Norte, it became endemic. Thid study aimed to evaluate the environmental and social aspectsof Leishmania chagasi infection and its epidemiologic transmission chain in an urban, periurban and rural area of Parnamirim-RN. A study with three sections was conducted: Section 1: Sectional study of the human and canine infection by L. chagasi and its environmental and social determinants. Section 2: Observational longitudinal cohort to evaluate the dynamics of the canine infection. Section 3: Longitudinal study to evaluate the behavior of Lu. Longipalpis vector and the seasonal factors related to its dynamics. To include in the study the hauses were randomly selected and georreferenciated. Montenegro skin test was done in the human population and blood samples were collected for anti-Leishmania antibody detection. The canine population was examinated for L. chagasi infection by RIFI, ELISA and ELISA for rK39. An
entomologic surveillance was monthly done with CDC light trapsin 10 houses of each locality. Quantitative and qualitative analyses was done using STATISC 6.0. Probality and prediction maps were done using ArcGis 9.0 model. In the human population L. chagasi infection was associated with the area of the hause, age, sex, population densyti, vegetation, kind of the floor of thr hause, water and resides destiny. In the canine population L. chagasi infection was associated with the breed, size, time of living in the hause, presence of dogs in the neighborhood, presence of horses and donkeys in the neighborhood, vegetation, kind of the floor and walls of the hause. The human infection was associated with canine infction only when analyzed taking into account the locality. In the prospective study, serum conversion and antibody lost observed in 30,8% and 22% of the animals examined, respectively. The human
infection rate by L. chagasi was 24,6%, by the presence of anti-Leishmania antibody and 38,6% by the Montenegro skin test. The canine infection rate 32,5% by the presence of anti-Leishmania antibody. The vector Lu longipalpis showed an atypical behavior. These results indicate that environmental and social factors are important variables associated with L. chagasi infection in humans and canines, with punctual association of thr last two. Control measures of the infection on the studied points are necessary, in the aim to reduce the endemic focus of the disease in the study area. This research was carried out in a multidisciplinary involving the categories of: doctor, biologist, veterinarian, statistical, pharmaceutical and biochemical","A leishmaniose visceral é uma doença que nos últimos 20 anos adaptou-se às áreas periurbanas e urbanas, tornando-se endêmica na região metropolitana de Natal, Rio Grande do Norte. Este estudo teve como objetivo avaliar os aspectos ambientais, sociais e a cadeia epidemiológica de transmissão por Leishmania chagasi em área urbana, periurbana e rural do Município de
Parnamirim-RN. Realizou-se um estudo com três subestudos: Subestudo 1: Estudo Transversal da infecção humana e seus determinantes socioambientais no ano de 2005. Subestudo 2: Estudo observacional longitudinal com coorte fixa para avaliar a dinâmica da infecção canina por L. chagasi no período de 2005/2006. Subestudo 3: Estudo longitudinal para avaliar a fauna de flebotomíneos e a densidade de L. longipalpis associando aos fatores climáticos. Para inclusão no estudo, os imóveis foram
selecionados aleatoriamente e georreferenciados. Na população humana desses imóveis, foi realizado teste de Montenegro e coleta de sangue para detecção de anticorpos antileishmania. A população canina foi examinada quanto à infecção por L. chagasi pelo método de RIFI, ELISA EB e ELISA para rK39. Foi realizado monitoramento entomológico mensal com armadilhas
CDC em 10 imóveis de cada localidade. Foi realizado análise quantitativa e qualitativa através do STATISC 6.0 e construção de mapas de predição e probabilidade através do modelo do ArcGis 9.0. Foi encontrada associação da infecção humana por L. chagasi com a área de residência, idade, sexo, densidade populacional, vegetação, tipo de piso do imóvel e destino de água
e dejetos. Na população canina, foi observada associação da infecção por L. chagasi quanto à raça, ao porte, sintomas, tempo de moradia no imóvel, presença de cães na vizinhança, presença de cavalos e jumentos na
vizinhança, tipo de vegetação da área. A infecção humana estava relacionada com a infecção canina apenas quando analisada considerando-se a localidade. No estudo prospectivo, foi observada soroconversão e perda de
anticorpos em 30,8% e 22% dos animais examinados, respectivamente. A taxa de infecção humana por Leishmania chagasi foi de 24,6%, quando avaliada pela presença de anticorpos antileishmania e de 38,6% quando avaliada pelo teste de Montenegro. A taxa de infecção canina foi 32,5% quando avaliada pela presença de anticorpos antileishmania. O vetor Lu. longipalpis apresentou um comportamento atípico. Os resultados indicam que fatores ambientais e sociais são importantes variáveis associadas à infecção por L. chagasi em humanos e caninos, sendo as últimas pontualmente
associadas. Desta forma, são necessárias medidas de controle da infecção que enfoquem os pontos estudados, visando a não manutenção da endemicidade na área estudada. Esta pesquisa foi realizada de forma multidisciplinar envolvendo as categorias de: médico, biólogo, veterinário, estatístico, nutricionista e farmacêutico bioquímico"
146,mestrado,17,Dec,2009,Desenvolvimento e caracterização de um sistema  microemulsionado contendo anfotericina b para uso oftalmológico,"Silveira, Walteçá Louis Lima da",Anfotericina B;Soluções Oftálmicas;Carreadores de Fármacos;Preparações Farmacêuticas;Microemulsões,,"As infecções fúngicas oculares estão sendo reconhecidas em todo o mundo como uma importante causa de morbidade e cegueira. A baixa biodisponibilidade dos fármacos como a anfotericina B, antifúngico bastante utilizado no tratamento destas infecções, nos tecidos posteriores dos olhos aliada às barreiras anatômicas oculares, que são capazes de limitar a sua
absorção e associado ao grave risco de desenvolvimento de reações adversas levam, geralmente, a um insucesso no tratamento desejado e a sérias conseqüências para os pacientes acometidos. Pesquisadores em todo o mundo estão buscando novas alternativas para contornar esta problemática e
uma das principais linhas de pesquisa estabelecidas consiste no
desenvolvimento de novas formulações que visam melhorar a
biodisponibilidade e reduzir a toxicidade associada à aplicação da anfotericina B. As microemulsões surgem como novos sistemas capazes de carrear este fármaco para uso oftalmológico. O presente estudo objetivou a obtenção de
uma microemulsão biocompatível com a via de administração ocular contendo anfotericina B a fim de se estabelecer uma nova forma farmacêutica viável para a administração tópica nos olhos. O sistema obtido demonstrou, por meio dos estudos de caracterização realizados, biocompatibilidade com a via de
administração pretendida e surge, portanto, como uma nova e interessante apresentação farmacêutica contendo anfotericina B para ser utilizada, no futuro, no tratamento de infecções fúngicas oculares"
147,mestrado,31,Jul,2009,Sanções disciplinares aplicáveis em caso de doping a atletas profissionais e não profissionais,"Cunha, Renata da Cruz",doping;atleta;sanção,,"A presente pesquisa descritiva do tipo documental centrou-se em analisar as sanções disciplinares aplicadas em caso de doping, a atletas profissionais e não profissionais que atuam no Brasil. A amostragem foi levantada através de um processo de seleção não probabilística intencional, utilizando-se como sujeitos, 18 atletas de uma modalidade esportiva dita não profissional: atletismo e 19 de uma modalidade profissional: futebol, de ambos os sexos, os quais tenham sido flagrados pelo exame de controle de dopagem da Confederação Brasileira de Atletismo (CBAt) e da Confederação Brasileira de Futebol (CBF). Como instrumentos de análise, foram utilizados os diagnósticos de dopagem positiva, arquivados junto a CBAt e CBF; além dos processos julgados pelo Superior Tribunal de Justiça Desportiva (STJD) do atletismo entre os anos de 2003/2007 e os processos julgados pelo STJD do futebol no ano de 2007. Os resultados demonstram que as sanções aplicadas aos desportistas diferem muito entre as modalidades incluídas no estudo. Enquanto encontramos, no atletismo a aplicação de sanções em conformidade com o Código Mundial Anti Doping (CMAD) com penalidades de no mínimo de dois anos, no futebol encontrou-se grande número de absolvições ou aplicação de penalidades conforme o Código Brasileiro de Justiça Desportiva (CBJD) que prevê penalidades muito inferiores. Por outro lado verificou-se ser a modalidade Futebol a que mais realiza controles, sendo certo que durante o ano de 2007 o desporto profissional realizou 4832 testes, ao passo que o desporto dito não profissional realizou tão somente 281. O caráter multidisciplinar do trabalho 12 pôde ser caracterizado pelo emprego de técnicas que envolveram direito, educação física, farmacologia"
148,mestrado,9,Oct,2009,"Caracterização fenotípica e genotípica de Staphylococcus
aureus resistentes à meticilina isolados na cidade do Natal/RN","Sousa Junior, Francisco Canidé de",Staphylococcus aureus resistentes à meticilina;MRSA;infecção hospitalar;clone epidêmico brasileiro;clone pediátrico;PFGE;SCCmec;métodos fenotípicos,,"Staphylococcus aureus resistente à meticilina (MRSA) é um dos principais agentes de infecções associadas a serviços de saúde em todo o mundo. No Brasil, há a predominância de um clone de MRSA multirresistente denominando clone epidêmico brasileiro (CEB). Entretanto, novos clones nãomultirresistentes com alta virulência têm sido descritos em infecções comunitárias e hospitalares. O objetivo desse estudo foi realizar a caracterização fenotípica e genotípica de cepas de MRSA isoladas na cidade do Natal/RN. Inicialmente avaliamos 60 amostras de S. aureus quanto a resistência à meticilina através de diferentes técnicas fenotípicas, utilizando a detecção do gene mecA por PCR como padrão. O antibiograma de todas as cepas foi realizado utilizando 12 antimicrobianos conforme descrito pelo CLSI. As cepas de MRSA foram caracterizadas geneticamente através da tipagem do cassete cromossômico estafilocócico mec (SCCmec) e da eletroforese em campo elétrico alternado (PFGE). Dos 60 S. aureus estudados, 45 foram resistentes à meticilina. Observamos que para algumas cepas de MRSA os testes de triagem em ágar com 6μg/mL de oxacilina e difusão em meio sólido com oxacilina-1μg apresentaram dificuldades na sua interpretação. No entanto, todas as 45 amostras de MRSA, foram facilmente detectadas pelos testes com o disco de cefoxitina-30μg e pesquisa da PBP2a. A análise molecular das cepas de MRSA mostrou 8 padrões distintos de PFGE (A-H), com predominância do padrão A (73%), relacionado ao CEB. Estas carreavam o SCCmec tipo IIIA, e apresentaram uma considerável variedade de subtipos (A1-A16). Cinco cepas de MRSA portando SCCmec IV também foram xiv identificadas, três delas relacionadas geneticamente ao clone USA800 (Padrão B). Destas cinco, três (2 padrão F e 1 padrão B) foram altamente susceptíveis as drogas testadas, entretanto, dois outros isolados, padrão B, apresentaram multirresistência. As amostras restantes pertenciam a padrões de PFGE distintos dos clones internacionais predominantes em nosso continente. Para realização deste projeto de pesquisa, a metodologia exigiu a interação com pesquisadores de áreas como: infectologia, microbiologia e biologia molecular. Portanto, esta dissertação apresentou um caráter de multidisciplinaridade e transdiciplinaridade no seu desenvolvimento"
149,mestrado,30,Sep,2009,"Análise da variabilidade da frequência cardíaca na síndrome
dos ovários policísticos","Sá, Joceline Cássia Ferezini de","síndrome dos ovários policísticos;modulação autonômica da
frequência cardíaca;risco cardiovascular",,"Objetivo: Avaliar a modulação autonômica da freqüência cardíaca(FC), a partir da análise de sua variabilidade(VFC), e verificar a sua correlação com outros fatores de risco para as doenças cardiovasculares em mulheres portadoras da Síndrome dos Ovários Policísticos (SOP) e num grupo controle de mulheres ovulatórias saudáveis. Métodos: Foram avaliadas 23 mulheres com diagnóstico de SOP pelo Consenso de Rotterdam e 23 mulheres ovulatórias saudáveis, com idade variando entre 20 e 34 anos. Foram considerados os índices da VFC no domínio do tempo (SDNN e rMSSD) e no domínio da frequência (baixa frequência-BF e alta frequência-AF), além de parâmetros antropométricos, bioquímicos e hormonais de avaliação do risco cardiovascular. Para comparações entre os grupos foram utilizados os testes estatísticos de Mann-Whitney e teste t não-pareado, além do teste de correlação de Pearson para análise de correlações entre as variáveis, com nível de significância de 5%. Resultados: Em comparação ao grupo controle, as mulheres com SOP apresentaram níveis significativamente mais baixos de progesterona e mais elevados de glicose, insulina, colesterol total, triglicerídeos, aspartato aminotransferase e proteína C-reativa (PCR) de alta sensibilidade. Em relação à VFC, as análises entre os grupos mostraram diferenças estatisticamente significativas, com diminuição dos índices SDNN e rMSSD no grupo SOP, quando comparado ao grupo controle (p<0,05). A análise da VFC no domínio da freqüência também demonstrou valores estatisticamente inferiores para BF e AF no grupo SOP, em comparação ao controle. Foram observadas correlações negativas estatisticamente significativas entre o índice de massa corporal e os índices SDNN, BF e AF, indicando que a modulação autonômica diminui com o aumento do peso. xiv Também foram observadas correlações negativas estatisticamente significativas entre os índices de VT5FC e os níveis de insulina de jejum, colesterol total, triglicerídeos e PCR de alta sensibilidade. Conclusão: O estudo mostra que a modulação autonômica da FC em mulheres com SOP estão reduzidas em comparação a mulheres ovulatórias saudáveis. Esse achado está correlacionado com o ganho de peso, dislipidemia e parâmetros de inflamação e resistência insulínica. Nesse sentido, medidas preventivas devem ser enfatizadas na abordagem clínica das pacientes com SOP, especialmente aquelas envolvendo orientação nutricional e atividade física regular"
150,mestrado,14,Sep,2009,Acurácia dos índices antropométricos de obesidade central na determinação de síndrome metabólica e fatores de risco cardiovascular em mulheres com síndrome dos ovários policísticos,"Costa, Eduardo Caldas","síndrome dos ovários policísticos;obesidade;fatores de risco
cardiovascular;síndrome metabólica;índices antropométricos",,"A síndrome dos ovários policísticos (SOP) é a desordem endócrina mais comum em mulheres com idade reprodutiva. Seu diagnóstico é firmado através do consenso de Rotterdam na presença de dois dos seguintes critérios: anovulação crônica, sinais clínicos e/ou bioquímicos de hiperandrogenismo e presença de micropolicistos nos ovários. Na SOP, além das características específicas da síndrome é comum a presença de marcadores de risco cardiovascular aumentado como dislipidemia, hipertensão arterial, resistência à insulina e obesidade central Objetivos: Analisar a acurácia diagnóstica da circunferência da cintura (CC), relação cintura-estatura (RCEst), razão cintura-quadril (RCQ) e índice de conicidade (Índice C) para detecção de fatores de risco cardiovascular (FRCV) e síndrome metabólica (SM) em mulheres com síndrome dos ovários policísticos (SOP). Metodologia: Foi realizado estudo transversal envolvendo 108 mulheres na faixa etária de 20-34 anos, com diagnóstico de SOP de acordo com o consenso de Rotterdam. Foram considerados parâmetros clínicos, antropométricos e bioquímicos de avaliação do risco cardiovascular. A análise dos dados foi desenvolvida em duas etapas, conforme descrito a seguir. Fase 1: análise da acurácia dos pontos de corte previamente determinados na literatura nacional para CC, RCEst, RCQ e Índice C, para predição de FRCV; Fase 2: determinação de pontos de corte dos índices antropométricos supracitados, específicos para mulheres com SOP, para discriminação de SM, através da análise da curva ROC (Receiver Operating Characteristic). Resultados: Com base nos achados da fase 1 do estudo, a RCEst foi o marcador que apresentou correlações positivas significativas com o xi maior número de FRCV (pressão arterial, triglicerídeos e glicemia após teste oral de tolerância à glicose), além de correlação negativa com HDL-colesterol. Os demais marcadores antropométricos se correlacionaram positivamente com pressão arterial, enquanto CC e RCQ apresentaram correlação positiva também com triglicerídeos. Todos os indicadores antropométricos apresentaram taxas de sensibilidade superiores a 60%, com destaque para a RCEst que apresentou sensibilidade superior a 70%. Na fase 2 da pesquisa observamos que a CC, RCEst e RCQ apresentaram desempenho semelhante na predição de SM, sendo superiores ao Índice C. Os valores de ponto de corte dos índices antropométricos para discriminar SM foram: CC = 95 cm; RCEst = 0,59; RCQ = 0,88; e Índice C = 1,25. Utilizando esses pontos de corte as taxas de sensibilidade e especificidade da CC e RCEst foram superiores às observadas para RCQ e Índice C. Conclusões: Nossos dados enfatizam a importância da avaliação antropométrica no rastreamento do risco cardiovascular em mulheres com SOP, destacando-se a relevância da RCEst na predição de FRCV clássicos e a necessidade de considerar pontos de corte específicos para mulheres com SOP para discriminação de SM"
