,program,day,month,year,title,author,key_words,abstract,resume
92,mestrado,17,Feb,2012,"Características físicas, somatotipo e desempenho de corredores de 100 e 400 metros no Rio Grande do Norte","Figueiredo, José dos Santos",Antropometria;Somatotipo;Endomorfia;Ectomorfia;Mesomorfo;Anthropometry;Somatotype;Endomorphic;Mesomorphic;Ectomorphic,"Objective: The aim of the study was to investigate physical characteristics and to
examine association between somatotype and performance in collegiate runners of
100 m and 400 m. Methods: The sample, male runners (n=39) competing at the
regional level in the state of Rio Grande do Norte, Brazil, had height, body mass,
skinfolds, limb circumference and skeletal breadths measured. Then, the somatotype
was calculated by Health-Carter method. Races (100 m and 400 m) were held to
assess athletic performance. Descriptive statistics were calculated for the total
sample, as well as for the 100 m and 400 m groups, and established four subgroups,
named quartiles. For analysis between groups of runners (100 m x 400 m) was used
Student's t test for independent samples. To examine the relationship between the
race times and anthropometric variables, was used the Pearson correlation test. The
somatotype dispersion distance and somatotype spatial distance were calculated
among subgroups. One-way analysis of variance, the Wilcoxon test followed of
Tukey post test, and correlation analysis were used with a significance level of
p<0.05. Results: Somatotype with mesomorphy and ectomorphy dominance was
exhibited by 100 m and 400 m athletes. Endomorphy was low in both groups,
especially in 400m runners, who had more elongated body types than 100 m
runners. When separately compared by athletic performance quartile, 100 m
sprinters of better qualifications (G100-G1) had somatotype with dominant
mesomorphy, whereas 400 m runners had somatotype with dominant ectomorphy. A
significant correlation (r = -0.55, p=0.008) between calf circumference and 100 m
race times was observed showing the importance of muscularity, whereas a
significant correlation was found between height and 400 m race times (r = -0.53,
p=0.02) showing the importance of linearity. Conclusion: Runners of 100 and 400
may show differences in physical characteristics, depending on the level of athletic
performance. Anthropometric periodic evaluations may help in the training process of
these athletes. However, more specific assessment parameters should be taken into
account, because somatotype by itself has not power to predict whether an individual
will succeed in racing speed","Objetivo: Investigar as características físicas e examinar a associação entre o
somatotipo e o desempenho em corredores de 100 e 400m. Métodos: As
características antropométricas e o desempenho atlético de corredores de 100 e
400m foram avaliados e comparados. A amostra foi composta de corredores do sexo
masculino (n = 39) de nível regional no Rio Grande do Norte, Brasil. Estatura, massa
corporal, dobras cutâneas, circunferência do membro e diâmetros ósseos foram
medidos. Em seguida, o somatotipo foi calculado pelo método de Heath-Carter.
Corridas de 100 e 400 m foram realizadas para avaliar o desempenho atlético. Para
a análise entre os grupos de corredores (100m x 400m) foi utilizado o teste t de
Student para amostras independentes. Foram calculadas estatísticas descritivas
para a amostra total, bem como para os grupos de 100 e 400m e estabelecidos
quatro subgrupos, nomeados quartis. Na comparação dos subgrupos oriundos da
distribuição quartil foi aplicada a análise de variância de um critério (ANOVA),
seguida do pós-teste de Tukey. Para analisar a relação entre os tempos de corrida e
as variáveis antropométricas, foi utilizado o teste de correlação de Pearson. A
comparação entre os quartis foi feita utilizando-se a distância de dispersão entre os
somatotipos (DDS) e a distância espacial entre os somatotipos (DES) para a análise
das dispersões bidimensionais e tridimensionais dos somatotipos24. Como critério
para determinação da existência de diferenças entre os grupos observou-se para a
DDS valores ≥ 2 e para a DES ≥ 124. Em toda a análise foi considerado um p valor
padrão de 0,05 e intervalo de confiança de 95%. Resultados: Atletas de 100 e
400m apresentaram somatotipo com dominância de mesomorfia e ectomorfia. A
endomorfia foi baixa em ambos os grupos, especialmente em corredores de 400m
que apresentaram tipo físico mais alongado do que os corredores de 100m. Quando
comparados separadamente por quartis de desempenho, corredores de 100m de
melhor qualificação (G100-G1) tinham somatotipo com dominância de mesomorfia,
enquanto os corredores de 400m de melhor qualificação (G400-G1) tinham
somatotipo com ectomorfia dominante. Foi observada uma correlação significativa (r
= -0,55, p = 0,008) entre a circunferência de perna e os tempos na corrida de 100m
o que mostra a importância da muscularidade, enquanto que uma correlação
significativa (r = -0,53, p = 0,02) foi encontrada entre a estatura e os tempos na
corrida de 400m mostrando a importância da linearidade. Conclusão: Corredores
de 100 e 400m apresentam algumas diferenças nas características físicas,
dependendo do nível de desempenho atlético. Avaliações antropométricas
periódicas podem ajudar no processo de treinamento destes atletas. No entanto,
parâmetros de avaliação mais específicos devem ser levados em conta, pois o
somatotipo, por si só, não tem poder para predizer se um indivíduo terá sucesso em
corridas de velocidade"
93,mestrado,16,Mar,2012,Eficácia do treinamento de força sobre parâmetros cardiovasculares e antropométricos em adultos sedentários,"Cabral, Carlos Ernani de Araujo Tinoco","Rigidez arterial;Proteína C-reativa ultrassensivel;Treinamento de
força muscular;Antropometria;Atividade física;Arterial stiffness;High-sensitive C-reactive protein;Strength training;Anthropometry;Physical activity","This study aimed to determine the influence of strength training (ST), in three weekly
sessions over ten weeks, on cardiovascular parameters and anthropometric
measurements. It is a before and after intervention trial, with a sample composed of 30
individuals. Participants were adults aged between 18 and 40 years, from both sexes
and sedentary for at least three months previously. Tests were computed
ergospirometry, CRP, PWV and body composition (dependent variables) before and
after the experiment. Independent variables, age and sex, were considered in order to
determine their influence on the dependent variablesevaluatedend. By comparing the
initial cardiovascular parameters with those obtained after intervention in patients
undergoing the ST proposed (a Student s t-test was conducted within each group for
samples matched to parameters with normal distribution, while the Wilcoxin was applied
for those without), there was no significant difference in PWV(p =0469) or PCR(p
=0.247), but there was an increase in anaerobic threshold(AT) (p=0.004) and Maximal
Oxygen Uptake(VO2max) (p =0.052). In regard to anthropometric measures, individuals
significantly reduced their body fat percentage (p<0.001) and fat mass (p<0,001), as
well as increasing lean mass (p<0.001). However, no changes were recorded in the
waist-to-hip ratio (WHR) (p= 0.777), body mass (p=0.226) or body mass index (BMI) (p
=0.212). Findings of this study lead us to believe that the proposed ST, and did not
increase the VOP or PCR improves cardiorespiratory capacity and body composition.
Devotees of this training can therefore safely enjoy all its benefits without risk to the
cardiovascular system","O objetivo desse estudo foi verificar a influência do TF, com frequência de três sessões
semanais e duração de dez semanas, sobre parâmetros cardiovasculares e
antropométricos. Trata-se de um estudo de intervenção do tipo antes-depois, cuja
amostra foi composta por 30 indivíduos. Os mesmos eram adultos com idade
compreendida entre 18 e 40 anos, de ambos os sexos e sedentários há pelo menos
três meses. Foram realizados os testes da ergoespirometria computadorizada, PCR,
VOP e composição corporal (variáveis dependentes), antes e logo após o experimento.
As variáveis independentes, idade e sexo, foram aferidas no sentido de verificar seus
efeitos sobre as variáveis dependentes avaliadas. Ao comparar os parâmetros
cardiovasculares iniciais com os obtidos após a intervenção nos indivíduos submetidos
ao TF proposto(através dos testes t de Student para amostras emparelhadas para os
parâmetros que tiveram distribuição normal e para os que não a possuíram, o
Wilcoxon), não houve diferença significativa nem na VOP (p =0.469) nem na PCR
(p=0,247), porém houve aumento no Limiar Anaeróbio (LA) (p=0,004) e no consumo
máximo de oxigênio (VO2máx) (p=0,052). Em relação às medidas antropométricas, os
indivíduos diminuíram significativamente o percentual de gordura (p<0,001) e a massa
de gordura (p<0,001), aumentaram a massa livre de gordura (p<0,001), porém não
alteraram a relação cintura-quadril (RCQ) (p= 0,777), massa corporal (p=0,226) nem o
índice de massa corporal (IMC) (p =0,212). Os achados do presente estudo nos levam
a crer que o TF proposto, além de não aumentar a VOP nem a PCR, melhora a
capacidade cardiorrespiratória e a composição corporal. Portanto, os adeptos de tal
treinamento podem usufruir, com segurança, de todos os seus benefícios sem risco ao
sistema cardiovascular"
94,mestrado,20,Oct,2011,Efeitos da deficiência de vitamina A na função pulmonar de crianças após infecção respiratória viral,"Amaral, Cleia Teixeira do",Deficiência de vitamina A;MRDR;Função pulmonar;Sibilância;Resistência respiratória,,"A deficiência marginal de vitamina A representa um estado onde a reserva hepática
dessa vitamina está diminuída sem apresentar sinais clínicos. A inflamação das vias
aéreas causada por infecção viral contribui para a hiper-reatividade brônquica,
promovendo aumento da resistência das vias aéreas, posteriormente normalizada.
Hipótese: A deficiência marginal de vitamina A pode influenciar a evolução da doença
respiratória viral, alterando sua gravidade e duração. O objetivo deste trabalho é avaliar
se há relação entre o estado da vitamina A e as alterações de função pulmonar em
pré-escolares durante uma infecção de vias aéreas superiores (IVAS). Trata-se de um
estudo transversal que avaliou 177 crianças entre 4 e 6 anos de idade, classificadas
em 3 grupos: 1. controle (n = 51); 2. crianças com sintomas de infecção de vias aéreas
superiores (IVAS) (n = 74): 3. grupo IVAS + crise de sibilância (n= 52). Determinou-se o
retinol sérico e o teste dose-resposta relativa modificado (Modified relative dose
response - MRDR) por cromatografia líquida de alta eficiência. Avaliou-se a resistência
respiratória total pela Técnica das Oscilações Forçadas (TOF) por Oscilometria de
Impulso (IOS). A identificação viral foi realizada pela Reação em Cadeia da Polimerase.
Avaliou-se o estado nutricional através dos escores-z para Peso/Idade, Altura/Idade,
Peso/Altura e Índice de Massa Corpórea/Idade. As médias para os índices A/I, P/I, P/A
e IMC/Idade foram de -0,29 ± 0,95; 0,22 ± 1,14; 0,56 ± 1,42 e 0,37 ± 0,97,
respectivamente. Identificou-se rinovirus em 19,5% (n=23) das crianças com IVAS. As
médias de retinol sérico dos grupos IVAS + crise de sibilância, IVAS e contole foram,
respectivamente, 17,5 ± 7,30; 32,1 ± 13,16 e 56,8 ± 29,82μg/dL, com diferença
significativa do grupo IVAS + crise de sibilância em relação aos demais grupos
(ANOVA, P< 0,0001). As médias de MRDR dos grupos IVAS + crise de sibilância, IVAS
e controle foram, respectivamente, 0,021 ± 0,021; 0,065 ± 0,046 e 0,007 ± 0,006
(ANOVA, P < 0,0001). A resistência respiratória total no grupo IVAS + crise de
sibilância e IVAS (126,0 ± 26,9 e 97,2 ±16,6 por cento do predictor, respectivamente)
foi significativamente maior (x2, p < 0,001) que no grupo controle 93,6 ± 18,0. A
recuperação da resistência respiratória total do grupo IVAS foi significativa (p < 0,005)
quando o MRDR < 0,030 e retinol sérico ≥ 20μg/dL, ficando prejudicada quando a
situação era de MRDR > 0,030 e retinol sérico < 20μg/dL. A recuperação da
resistência respiratória total do grupo IVAS + crise de sibilância foi significativa
independentemente do valor do retinol ou do MRDR (p < 0,001). Os controles tinham MRDR < 0,030. Os resultados indicam que 65% das crianças do grupo IVAS + crise de
sibilância apresentam reservas hepáticas de vitamina A adequadas e retinol sérico
deficiente/deficiente marginal. A resistência respiratória total das crianças do grupo
IVAS com MRDR deficiente, persiste alterada até três semanas após a fase aguda da
infecção. Em conclusão, este estudo demonstra que níveis marginais de vitamina A
alteram a resistência respiratória, com uma defasagem no tempo de recuperação pósinfecção
viral"
95,mestrado,14,Jul,2011,"Segurança e eficácia da tibolona na transição menopausal: um ensaio clínico randomizado, duplo-cego e controlado com placebo","Morais, Maria Socorro Medeiros de",Transição menopausal;Menopausa;Tibolona;Escala climatérica de Greene;Índice menopausal de Blatt e Kupermann;Síndrome Climatérica.,,"Embora a Transição Menopausal e a menopausa sejam eventos biológicos normais, podem ser acompanhadas de agravos que aumentam o risco de morbidade e mortalidade com destaque para os sintomas agudos da Síndrome Climatérica(SC). O tratamento visa o controle destes sintomas para evitar as consequências tardias da deficiência estrogênica, sempre considerando a segurança e a tolerabilidade ao fármaco empregado e os fatores de risco para complicações futuras. Objetivo: Avaliar a eficácia, o perfil de segurança e tolerabilidade do uso da tibolona na transição menopausal. Material e métodos: Estudo randomizado, duplo-cego, controlado com placebo, envolvendo 65 mulheres saudáveis com idade média de 48,5(±3.5) anos. Critérios de Inclusão: a) idade entre 40 e 55 anos; b) útero sem anormalidades avaliado por ultrassonografia transvaginal e com espessura endometrial≤10 mm; c) irregularidade menstrual nos últimos 6 meses e amenorreia inferior a 12 meses; d) níveis séricos de Hormônio Folículo Estimulante(FSH)>30mIU/ml; e) SC avaliada pelo Índice Menopausal de Blatt e Kupperman (IMK) com escore de pontos>14; f) Índice de Massa Corporal<30Kg/m2; g) mamografia com BI-RADS igual a 1 e 2; e ) valores de bioquímica sanguínea, pós jejum de 12 horas, dentro dos limites de normalidade. Critérios de exclusão: a) fumo; b) uso nos 90 dias que antecederam a entrada no estudo de qualquer medicação hormonal, psicotrópica ou que interfiram com metabolismo glicídico e lipídico; c) qualquer doença neoplásica anterior ou atual; d) hipertensão arterial(pressão sistólica≥160 mmHg e diastólica≥105 mmHg); e) doenças hepáticas e renais; f)desordens cerebrovasculares, tireoideanas, cardiovasculares e
1-xiv
tromboembólicas; g) doenças mentais; e h) diabetes mellitus. Trinta participantes foram escolhidas pelo método randômico para o Grupo Tibolona (GT) que recebeu 2,5 mg/dia de tibolona por via oral durante 12 semanas contínuas; as demais 35 foram incluídas no Grupo Placebo (GP) que recebeu 1 cápsula/lactose/dia, por igual período. Medidas utilizadas: A eficácia da tibolona foi avaliada pelo IMK e a Escala Climatérica de Greene (GSC). Na avaliação da segurança e tolerabilidade utilizou-se parâmetros bioquímicos (perfil lipídico, glicemia e função hepática), medida da espessura endometrial, o registro diário de queixas relacionadas com o tratamento e a evolução de medidas antropométricas {Índice de Massa Corporal(IMC), Circunferência da Cintura(CC) e Razão cintura/quadril(RCQ)}.Resultados: Cinquenta e sete participantes (87,7%) concluíram o estudo. Ao final de 12 semanas, ao se comparar os dois grupos, em relação aos valores basais, observa-se: no GT uma diminuição significativa nos sintomas climatéricos: IMK (35,5 + 6,7 vs. 11,3 + 6,5) e GSC (31,9±4.6 vs. 19,8 + 10,5) p<0,001; melhora do perfil lipídico com redução do Triglicerídeos (152,2 + 53,0 vs. 105,2 + 26,8)p<0,001, colesterol total (220,7 + 38,5 vs. 193,3 + 37,9) p=0,001 e LDL colesterol (144,7 + 36,9 vs. 129,0 + 43,6)p=0,03; redução em 25,7% na relação Triglicerideos/HDL-c, fator preditor de resistência insulínica e de risco para doença arterial coronariana. No mesmo grupo, observou-se redução de 21% na espessura endometrial em relação ao valor basal (8.1 ± 2.6 vs 6.4 ± 1.9; p<0,05), compatível com atrofia; não houve alterações nos marcadores hepáticos e nem relatos de efeitos colaterais que levassem a interrupção do tratamento. Conclusões: A tibolona mostrou-se eficaz para reduzir a sintomatologia climatérica de mulheres na transição menopausal, com boa tolerabilidade e melhora no perfil lipídico. A
1-xv
atrofia endometrial sugere provável segurança para o seu uso como agente terapêutico da transição menopausal."
96,mestrado,28,Mar,2012,Avaliação da atividade antioxidante e antiproliferativa do extrato aquoso de frutas tropicais,"Barros, Joanna de ângelis da Costa",Antioxidante;Atividade antiproliferativa;Frutas tropicais;Alimentos funcionais.;Antioxidant;Antiproliferative;Tropical fruits;Functional foods,"The antioxidant activity of aqueous extracts of five edible tropical fruits (Spondias lutea,
Hancornia speciosa, Spondias purpurea, Manilkara zapota and Averrhoa carambola)
was investigated using different methods. The amount of phenolic compounds was
determined by the Folin-Ciocalteu reagent. The M. zapota had Total Antioxidant
Capacity (TAC) higher than the other fruits. Extracts showed neither reducing power nor
iron chelation (between 0.01 and 2.0 mg/mL). H. speciosa exhibited the highest
superoxide scavenging activity (80%, 0.5 mg/mL). However, at high concentrations (8.0
mg/mL) only A. carambola, S. purpurea and S. lutea scavenging 100% of radicals
formed. M. zapota and S. purpurea had higher phenolic compound levels and greater
OH radical scavenging activity (92 %, 2.0 mg/mL). Antiproliferative activity was
assessed with 3T3 fibroblasts and cervical tumor cells (HeLa). The most potent extract
was S. purpurea (0.5 mg/mL), which inhibited HeLa cell proliferation by 52%. The most
fruits showed antioxidant and antiproliferative properties, characterizing them as
functional foods.","A atividade antioxidante de extratos aquosos de cinco frutas tropicais (Spondias lutea,
Hancornia speciosa, Spondias purpúrea, Manilkara zapota e Averrhoa carambola) foi
investigada por diferentes métodos. A quantidade de compostos fenólicos foi
determinada pelo uso do reagente Folin-Ciocalteu. O extrato da fruta M. zapota
apresentou Capacidade Antioxidante Total (CAT) superior aos demais extratos. As
frutas estudadas não apresentaram nem poder redutor nem quelação férrica (de 0,01 a
2,0 mg/mL). A H. speciosa apresentou alta atividade seqüestradora do radical
superóxido (80% a 0,5 mg/mL) e na concentração de 8,0 mg/mL a A. carambola, a S.
purpúrea e a S. lutea seqüestraram 100% dos radicais formados. A M. zapota e a S.
purpurea apresentaram maior teor de compostos fenólicos e maior atividade
sequestradora do radical hidroxila (92 % a 2,0 mg/mL). A atividade antiproliferativa foi
avaliada em células de fibroblastos de rato (3T3) e em células tumorais de colo de
útero humano (HeLa). O extrato mais potente foi o de S. purpurea (0,5 mg/mL) que
inibiu em 60% da proliferação das células HeLa. A maioria das frutas apresentaram
propriedade antioxidante e antiproliferativa o que possibilta maiores investigações
sobre um possível caráter funcional."
97,mestrado,27,Jun,2011,Síndrome metabólica e fatores de risco relacionados em crianças e adolescentes com excesso de peso na cidade do Natal,"Macedo, Taisa Barreto Medeiros de Araujo",Obesidade;Sobrepeso;Síndrome metabólica;Fatores de risco;Crianças.,,"Nas últimas décadas, houve grande aumento da prevalência de
obesidade, inclusive na faixa etária pediátrica. Com isso, aumentou o número
de crianças e adolescentes afetados por síndrome metabólica (SM), diabetes
tipo 2 (DM2) e doenças cardiovasculares (DCV), doenças anteriormente
consideradas quase exclusivas de adultos. Os objetivos do estudo foram
identificar e correlacionar marcadores antropométricos (IMC- índice de massa
corpórea, CA- circunferência abdominal, RCQ- razão cintura/quadril, RCArazão
cintura altura e PSE- prega subescapular), PAS e PAD- pressão arterial
sistólica e diastólica, respectivamente, e laboratoriais (CT- colesterol total, HDL,
LDL, TGL- triglicérides, I/G- razão insulina glicose, HOMA- homeostatic model
assessment for insulin resistance) de risco para o desenvolvimento de SM e
observar a sua prevalência em crianças e adolescentes com excesso de peso.
Foi conduzido estudo transversal, em amostra aleatória, de
conveniência, onde foram avaliadas 60 crianças e adolescentes com excesso
de peso, atendidas no ambulatório de endocrinologia pediátrica do Hospital de
Pediatria da Universidade Federal do Rio Grande do Norte (UFRN) com idade
mínima e máxima de 7 e 15 anos, de maio de 2009 a abril de 2010. Foram
admitidos os indivíduos que apresentavam sobrepeso (IMC P > 85 e < 95) ou
obesidade (IMC P > 95) (CDC, 2000) e história familiar positiva para DM2 em
parentes de primeiro ou segundo grau ou algum dos sinais de resistência
insulínica (acantose, hipertensão arterial, dislipidemia, síndrome de ovários
policísticos).
2
O componente individual para SM mais prevalente foi o percentil da CA
≥ 90 (58,3%), seguido de HDL ≤ 40 mg/dl (36,6%).
Na regressão linear simples, observaram-se as variações para mais nos
parâmetros laboratoriais e de PA para cada unidade de aumento de IMC, CA,
RCA, RCQ e PSE, sendo significantes as seguintes correlações: CA com TGL,
HOMA IR, I/G, PAS e PAD; RCQ com TGL, HOMA, I/G, LDL e glicemia; RCA
com TGL; PSE com TGL, HOMA-IR, I/G e PAS; e IMC com HOMA IR, I/G, PAS
e PAD. De acordo com os critérios da IDF (Federação Internacional de
Diabetes   International Diabetes Federation) 2007, o diagnóstico de SM foi
encontrado em seis indivíduos (10%). Do total, oito (13,3%), estavam em
situação de sobrepeso e 52 (86,6%), obesos.
As evidências de correlação CA e RCQ, medidas de obesidade
centrípeta, com vários marcadores como TGL e HOMA, já sabidamente
relacionados à SM, chamam atenção para a necessidade de utilização dessas
medidas de forma mais rotineira na prática pediátrica, por serem de fácil
obtenção, baixo custo e método não invasivo.
Os valores de CA, RCQ, RCA e PSE, quando elevados devem justificar
maior detalhamento na avaliação laboratorial de possível resistência insulínica.
É importante a identificação de crianças e adolescentes que preencham os
requisitos para o diagnóstico da SM, pois são indivíduos de maior risco
metabólico e devem ser adequadamente acompanhados."
98,mestrado,19,Dec,2011,Comparação da incidência de câncer em infectados pelo HIV e em transplantados com a população geral,"Cobucci, Ricardo Ney Oliveira",Neoplasia;Incidência;HIV;AIDS;Transplante.,,"Introdução: Estudos demonstram uma relação entre a queda da imunidade e o aumento da incidência de câncer. Objetivo: Comparar a incidência de câncer em pacientes infectados pelo HIV e em transplantados com a da população geral. Métodos: Foi realizada revisão sistemática com metanálise, combinando descritores específicos nas bases de dados Pubmed, Scielo, Cancerlit e Google Scholar, buscando alta sensibilidade para responder o objetivo da pesquisa. Os artigos considerados de alta qualidade metodológica por apresentarem todos os critérios de inclusão foram avaliados por metanálise. Resultados: Foram incluídos 25 estudos envolvendo 866776 pessoas com HIV/AIDS e transplantados, em que foram diagnosticados 21260 novos casos de carcinoma. Observou-se que o risco para o surgimento de novos casos de câncer foi maior entre indivíduos com HIV/AIDS (SIR= 4, IC95% 3,78-4,24) e entre os transplantados (SIR= 3,28, IC95% 3,06-3,52) quando comparado com a população em geral. Conclusão: A incidência similar em ambas as populações pesquisadas sugere que o comprometimento do sistema imune, comum em ambas, é responsável pelo risco aumentado de novos casos de câncer. Investimentos em pesquisas que desenvolvam estratégias de prevenção mais eficazes para os dois grupos são necessários, pois podem contribuir para a redução da incidência e para a diminuição da mortalidade."
