,program,day,month,year,title,author,key_words,abstract,resume
41,mestrado,31,Jul,2014,Propriedades bioativas dos polissacarídeos sulfatados da alga comestível Gracilaria birdiae,"Oliveira, Letícia Castelo Branco Peroba de",Galactana sulfatada;Alga vermelha;Urolitíase,"Red marine algae of the genus Gracilaria synthesize sulfated polysaccharides (PS) bioactive. But
many of these PS were not properly assessed, as is the case of PS synthesized by edible seaweed
Gracilaria birdiae. Previous studies showed that sulfated galactans this alga has anti-inflammatory
effect. In this work, a galactan (GB) of G. birdiae was obtained and evaluated by different tests. GB
showed anticoagulant activity in APTT assay. GB showed no toxicity to normal cells (3T3), but
inhibited the survival of cells of adenocarcinoma of the cervix (HeLa) and human pancreatic cancer
(Panc-1) 80% (1.5 mg / ml). GB was not able to hijack the OH radical or the superoxide radical.
However, showed activity electron donor in two different tests and presented iron chelator activity
(70% and 1.0 mg / ml) and Copper (70% at 0.5 mg / ml). The presence of a higher GB promotes
formation of crystals of calcium oxalate dihydrate small size, which is less aggressive, because GB
is able to interact with and stabilize the crystal that form. Furthermore, GB (2.0 mg / mL) was not
cytotoxic to human renal cells (HEK-293). The data lead us to propose that GB has a great potential
for the treatment of urolithiasis","As algas marinhas vermelhas do gênero gracilaria sintetizam polissacarídeos sulfatados (PS) bioativos. Porém muitos destes PS ainda não foram devidamente avaliados, como é caso dos PS sintetizados pela alga comestível Gracilaria birdiae. Estudos anteriores mostraram que galactanas sulfatadas dessa alga tem efeito antiinflamatorio. Neste trabalho uma galactana (GB) de G. birdiae foi obtida e avaliada por diferentes testes. GB apresentou atividade anticoagulante no teste de APTT. Gb não apresentou toxicidade para células normais (3T3), mas inibiu a sobrevivência de células de adenocarcinama de colo de útero (HeLa) e human pancreatic carcinoma (Panc-1) em cerca de 80 % (1.5 mg/mL). GB não foi capaz de sequestrar o radical OH nem o radical superoxido. Contudo, apresentou atividade doadora de elétrons em dois testes diferentes e apresentou atividade quelante de ferro (70% a 1.0 mg/mL) e de cobre (70% a 0.5 mg/mL). A presença de GB promove uma maior formação de cristais de oxalato de cálcio dihidratado de pequeno tamanho, que é a forma menos agressiva, isso porque GB é capaz de interagir com o cristal e estabilizar essa forma. Além disso, GB (2.0 mg/mL) não foi citotóxico para células renais humanas (HEK-293). Os dados obtidos nós levam a propor que GB apresenta um grande potencial para o tratamento de urolitíase."
42,mestrado,4,Jun,2014,Análise microbiológica da cavidade interna de implantes dentais osseointegrados utilizando o checkerboard DNA-DNA hybridization,"Lucena, George Alexandre de Barros",Implantes dentais;Microbiologia;Checkerboard DNA-DNA hybridization,,"Introduction: Infiltration of organic fluids and microorganisms at the abutment/implant interface may result in bacterial infection of peri-implant tissues. Internal colonization of periodontal pathogens may be caused by bacteria trapped during installation or penetration of abutment/implant leakage. The aim of this study was to detect periodontal pathogens in the internal area of dental implants before loading. 
Materials and Methods: Seventy-eight implants in 32 partially edentulous subjects were selected for this evaluation. A bacterial biofilm sample of the internal surface of each implant was taken and analyzed for the presence of 40 microorganisms by checkerboard DNA-DNA hybridization, prior to installation of healing or any other prosthetic abutment.
Discussion: Bacteria were detected in 20 patients (62.5%), distributed in 41 implants (52.6%). Forty-seven percent of implants showed no bacterial detection. Spontaneous early implant exposure to oral cavity during the healing period was not significant (P >0.05) to increase bacterial prevalence, but implants placed at mandible had higher bacterial prevalence than maxillary ones.
Conclusion: The internal surface of dental implants can serve as a reservoir of periodontal pathogens for future implant/abutment interface."
43,mestrado,31,Aug,2007,"Candidíase vulvovaginal: sintomatologia, fatores de risco e colonização anal concomitante","Holanda, Antônio Arildo Reginaldo de",Candidíase vulvovaginal;Sintomatologia;Fatores de risco;Symptomatology;Risk factors,"Post-menarche patients with clinical signs of vulvovaginitis were analyzed in this study, whose aims were the following: identify the frequency of C. albicans and non C. albicans species and negative results, correlate the vaginal culture for yeast with risk factors and symptomatology; compare positive and negative results for yeast in the vaginal and anal cultures; compare the positive results for C. albicans with other results found in the vaginal and anal cultures; and compare concomitant positivity for C. albicans and non C. albicans in the vaginal and anal cultures. Sample selection occurred between May, 2003 and May, 2005, and included 99 patients from Natal, Brazil. The laboratory methods used consisted of CHROMagar Candida culture medium, thermotolerance test at 42-45°C and hypertonic NaCL, in addition to the classic methods of carbohydrate assimilation and fermentation. We used absolute numbers, percentages, means of central tendency, chi-squared test (χ2) with Yates  correction, Fisher s exact test and odds ratio for statistical analysis. The most frequent species was C. albicans in 69% of the cases. The positivity for Candida spp showed an association with the use of tight-fitting intimate clothing and/or synthetics, allergic diseases and the occurrence of itching, leukorrhea and erythema. Anal colonization increased the likelihood of vaginal contamination by 2.8 and 4.9 times, respectively, for Candida spp and C. albicans. When compared to the other species, C. albicans-positive anal colonization increased by 3.7 times the likelihood of vaginal positivity. These data suggest likely vaginal contamination originating in the anus","Pacientes após a menarca, com quadro clínico compatível com vulvovaginite foram analisadas no presente estudo, cujos objetivos foram: identificar a frequência de espécies de C. albicans, não C. albicans e resultados negativos; correlacionar a cultura vaginal para leveduras com fatores de risco e sintomatologia; comparar resultados positivos com os negativos para leveduras nas culturas vaginais e anais; comparar os resultados positivos para C. albicans com outros resultados encontrados nas culturas vaginais e anais; comparar a positividade concomitante para C. albicans e não C. albicans nas culturas vaginais e anais. A seleção da casuística ocorreu entre maio de 2003 e maio de 2005, sendo incluídas 99 pacientes, procedentes de Natal, RN. Os métodos laboratoriais utilizados consistiram em cultivo em CHROmagar Candida, provas de termotolerância a 42-45oC e NaCl hipertônico, além dos métodos clássicos de assimilação e fermentação de carboidratos. Para a análise estatística foram utilizados números absolutos, percentuais, medidas de tendência central, Teste do qui-quadrado (χ2) com correção de Yates e Teste exato de Fisher, além de Odds ratio. A espécie mais freqüente foi C. albicans em 69% dos casos. A positividade para Candida spp apresentou associação com o uso de roupas íntimas justas e/ou sintéticas, doenças alérgicas e ocorrência de prurido, leucorréia e eritema. A colonização anal determinou um aumento da chance para colonização vaginal, sendo 2,8 e 4,9 maior, respectivamente para Candida spp e C. albicans. A colonização anal positiva para C. albicans implicou numa chance 3,7 vezes maior para a positividade vaginal em comparação às outras espécies. Esses dados sugerem uma provável contaminação vaginal a partir do ânus"
44,mestrado,17,Aug,2006,Nanosistemas de penicilina G benzatina para tratamento profilático da febre reumática: estudo analítico,"Silva, Kattya Gyselle de Holanda e",Penicilina G Benzatina;Fármacos;Curva de calibração;Penicillin G Benzatina;Drug;Curve of calibration,"Investigations in the field of pharmaceutical analysis and quality control of medicines require analytical procedures with good perfomance characteristics. Calibration is one of the most important steps in chemical analysis, presenting direct relation to parameters such as linearity. This work consisted in the development of a new methodology to obtain calibration curves for drug analysis: the stationary cuvette one. It was compared to the currently used methodology, and possible sources of variation between them were evaluated. The results demonstrated that the proposed technique presented similar reproducibility compared to the traditional methodology. In addition to that, some advantages were observed, such as user-friendliness, cost-effectiveness, accuracy, precision and robustness. Therefore, the stationary cuvette methodology may be considered the best choice to obtain calibration curves for drug analyis by spectrophotometry","As investigações no campo do controle de qualidade e da análise de fármacos requerem procedimentos analíticos com boas características de desempenho. A calibração é uma das etapas mais importantes na análise química, apresentando a relação direta aos parâmetros tais como linearidades. Este trabalho consistiu no desenvolvimento de uma metodologia nova para obter curvas de calibração para a análise de fármaco: a cubeta estacionária. Foi comparado à metodologia atualmente usada, e as fontes possíveis da variação entre elas foram avaliadas. Os resultados demonstraram que a técnica proposta apresentou parâmetros semelhantes à metodologia tradicional. Além de algumas vantagens como facilidade na execução, baixo custo, exatidão, precisão e robustez. Conseqüentemente, a metodologia da cubeta estacionária pode ser considerada como metodologia de escolha para obter curvas de calibração para a análise de fármacos por espectrofotometria"
45,mestrado,28,Dec,2006,Determinação dos fatores neuroepidemiológicos das crises convulsivas em recém nascidos internados em unidades de terapia intensiva,"Holanda, Manoel Reginaldo Rocha de",Ataques;Valor preditivo dos testes;Sensibilidade e especificidade;Mortalidade;Prematuro,,"O objetivo do nosso projeto foi determinar as características dos recém nascidos com crises convulsivas internados em unidades de terapia intensiva.  Foi realizada uma pesquisa multicêntrica, observacional, prospectiva, cuja população alvo foi os recém nascidos com crises convulsivas internados em unidades de terapia intensiva, envolvendo equipe multidisciplinar constituída por neurologista infantil, neonatologistas, intensivistas pediátricos, enfermeiros, técnicos de enfermagem e fisioterapêutas. As crises foram definidas pelo critério clínico, com classificação de Volpe. Variáveis relacionadas à gestação, ao parto, características dos recém nascidos, aspectos das crises convulsivas e mortalidade foram analisadas. Estatística: descritiva (freqüências, medidas de tendência central e dispersão) e análise (teste de probabilidade, teste de risco e de acurácia). Comparamos as crises clínicas entre os recém nascidos de termo e pretermo e observamos diferenças com significância estatística na idade de início das crises, mais tardia nos prematuros, na etiologia predominante: hemorragia peri-intraventricular no prematuro e encefalopatia hipóxico-isquêmica no termo e tipo clínico de crise, clônica no pretermo e sutil no termo. Os testes de acurácia utilizados para determinar se o tipo clínico de crise convulsiva é predictor da etiologia da mesma não revelaram resultados positivos. Quanto às características associadas à mortalidade de prematuros com crise convulsiva, observamos associação entre ventilação mecânica e pneumonia com a mortalidade. Existem diferenças clínicas quando comparamos os recém nascidos pretermo e de termo com crises convulsivas, confirmando dados da literatura"
46,mestrado,10,Aug,2007,Fisioterapia e sociedade: ações do Sistema Único de Saúde no Rio Grande do Norte,"Teixeira, Geraldo Magella",Fisioterapia;Sistema Único de Saúde;Humanização;Physiotherapy;SUS;Humanization,"The work has objective to present actions of Physiotherapy, developed by SUS in the State of Rio Grande do Norte; discuss under the humanization point of view such actions of health; discuss the importance of physioterapy to the Norte-Riograndense, or maybe its role in the perpetuation of actions of health centered in the binomial cause/efect. The study was done in the State of Rio Grande do Norte. The data were obtained through public sources gathered in the health secretrary ship of this State. The collected data talks about physiotherapy sections developed by SUS in several areas of the State; such data was collected and analysed after the aproval of Ethic and Resarch Committee of Federal University of Rio Grande do Norte. Concerning the physiotherapy, along with the State Health Secretaryship of the State fo Rio Grande do Norte, there were only records of attending based on cure/rehabillitation, not being observed during the curse of study, any record or action of prevention, promotion and protection towards health. It s possible to notice that  there is a highligth to the interventions focusing on the treatment of illness of rheumatic origin and general complaints related to the vertebral column. Such research evidenced that the Physiotherapy in the SUS in the State priorizes the individualized attending centered in the  carteziano health/illness model, where the developde actions are turned to the curative and rehabilliting attention, with role fo some or no highligth in the primary attention","O trabalho tem como objetivo apresentar ações fisioterápicas desenvolvidas no Sistema Único de Saúde (SUS) no estado do Rio Grande do Norte; discutir sob a óptica da humanização tais ações; discutir a importância da fisioterapia para a sociedade norte-riograndense e seu papel na perpetuação de ações de saúde centradas no binômio causa/efeito. O estudo foi realizado no estado do Rio Grande do Norte. Os dados foram obtidos de fontes públicas junto à Secretaria de Saúde desse Estado. Os dados colhidos versam sobre sessões de fisioterapia desenvolvidas pelo SUS nas diversas regiões do estado; tais dados foram colhidos e analisados após aprovação do comitê de ética e pesquisa da Universidade Federal do Rio Grande do Norte. No tocante a fisioterapia, houve junto a Secretaria de Saúde do Estado do Rio Grande do Norte, apenas registros de atendimentos voltados para a cura/reabilitação, não sendo observado durante decorrer do estudo, qualquer registro de intervenção de prevenção, promoção e proteção à saúde. É possível observar que há destaque para as intervenções voltadas para o tratamento de doenças de origem reumáticas e queixas relacionadas à coluna vertebral. Tal pesquisa evidenciou que a fisioterapia no SUS no estado prioriza o atendimento individualizado, centrado no modelo saúde/doença e as ações desenvolvidas estão voltadas para a atenção curativa e reabilitadora, com papel de pouco destaque na atenção primária"
47,mestrado,15,Sep,2004,Abordagem dos aspectos psicológicos da mulher infértil :um estudo quali-quantitativo,"Moreira, Simone da Nóbrega Tomáz",Estresse;Ansiedade;Aspectos psicológicos;Infertilidade conjugal;Psicologia da saúde;Stress;Anxiety;Psychological aspects;Infertile women;Conjugal infertility,"Purpose: assess the frequency of stress and anxiety levels in infertile women, correlate these aspects with risk factors and qualitatively analyze feelings resultant from the inability to conceive, in order to obtain data for specific psychological guidance. Methods: the case-control study included a total of 302 women, 152 being infertile (case group: 30.3 ± 5.4 years), and 150 non-fertile (control group: 25.7 ± 7.9 years). The quantitative approach involved the application of  Lipp s Stress Symptoms Inventory (LSSI) and State-Trait Anxiety Inventory (STAI), whereas the qualitative approach consisted of a semi-structured interview. Response variables considered were: stress frequency and anxiety scores (State and Trait). Statistical analysis compared frequencies and medians between groups, by means of qui-squared and Mann-Whitney tests, respectively, and constructed logistical regression models to test associations between response variables and risk factors considered. Qualitative data were analyzed descriptively and categorized in order to perform correspondence analysis. The level of significance was 5%. Results: in the study sample, stress frequency was higher in the case group than in the control(61.8 and 36.0%, respectively), however, significant differences were not observed between groups in relation to stress phases and predominant symptomology type. With respect to anxiety, there were no significant differences between case and control groups as to median state scores [39.5 (35.0   46.0) and 41.0 (35.7   47.0 ); respectively) and anxiety trait scores [44.0 (34.0   51.0) and 42.0 (36.0   49.2); respectively). Risk factors  significantly associated with greater risk for high anxiety scores in the case group were: primary infertility, unawareness of the causal factor, diagnostic phase investigation, religion, lack of children from other marriages and the fact that the woman was previously married. The qualitative approach demonstrated that infertility provokes emotional responses, such as sadness, anxiety, anger, fear and guilt. Conclusions: it can be concluded that  infertile women are more vulnerable to stress; however, they are capable of adapting to stressful events without serious physical or psychological compromising","Objetivo: avaliar a freqüência de estresse e níveis de ansiedade em mulheres inférteis, correlacionar esses aspectos com fatores de risco e analisar, qualitativamente, os sentimentos advindos da incapacidade de conceber, de forma a obter subsídios para uma orientação psicológica específica. Métodos: o estudo incluiu um total de 302 mulheres, sendo 152 inférteis (grupo caso: 30,3 ± 5,4anos), e 150 não-inférteis (grupo controle: 25,7 ± 7,9 anos). A abordagem quantitativa envolveu a aplicação do Inventário de Sintomas de Estresse de Lipp (ISSL) e Inventário de Ansiedade Traço-Estado (IDATE), ao passo que a abordagem qualitativa consistiu de uma entrevista semi-estruturada. As variáveis resposta consideradas foram: freqüência de estresse e escores de ansiedade (Estado e Traço). A análise estatística compreendeu a comparação de freqüências e medianas entre os grupos, por meio dos testes qui-quadrado e Mann-Whitney, respectivamente, assim como a construção de modelos de regressão logística para testar associações entre as variáveis resposta e os fatores de risco considerados. Os dados qualitativos foram analisados de forma descritiva e categorizados para realização de análise de correspondência. O nível de significância adotado foi de 5%. Resultados: na amostra estudada, a freqüência de estresse foi maior no grupo caso do que no controle (61,8 e 36,0%; respectivamente), no entanto, não foram observadas diferenças significativas entre os grupos com relação às fases do estresse e tipo de sintomatologia predominante. Em relação à ansiedade, não houve diferenças significativas entre os grupos caso e controle quanto às medianas dos escores de estado (39,5 e 41,0; respectivamente) e traço (44,0 e 42,0; respectivamente) de ansiedade. No grupo caso, os fatores de risco associados significativamente com estresse ou ansiedade foram: infertilidade primária, desconhecimento do fator causal, fase de investigação diagnóstica, religião e ausência de filhos advindos de outros casamentos. Na abordagem qualitativa, as mulheres inférteis expressaram as seguintes respostas emocionais predominantes: tristeza, ansiedade, raiva, medo e culpa. Conclusões: os resultados permitem concluir que as mulheres inférteis estão mais vulneráveis ao estresse, no entanto, são capazes de responder aos eventos estressores de forma adaptativa, sem comprometimentos mais sérios nas áreas física e psicológica"
48,mestrado,17,Oct,2004,A concepção de professores do ensino fundamental (1ª e 4ª) sobre a saúde do escolar,"Fernandes, Marcos Henrique",Saúde escolar;Educação em saúde;Docente,,"Com a criação dos Parâmetros Curriculares Nacional (PCNs), a saúde passou a ser um tema transversal que deve ser trabalhado por todos os níveis de ensino em toda a escola, principalmente pelos professores do ensino fundamental, os quais têm uma grande responsabilidade no processo de formação dos valores e de condutas dos escolares. Com o objetivo de investigar a concepção dos professores de ensino fundamental (1ª a 4ª séries) sobre a saúde do escolar, este estudo teve como amostra 45 professoras lotadas em 04 escolas públicas e 04 escolas privadas no município de Natal/RN. Para a coleta dos dados foi utilizado um questionário semi-estruturado, sendo os mesmos analisados por meio da análise temática. A faixa etária com maior prevalência foi a superior a 40 anos, com 58% de professoras. Com relação ao grau de formação acadêmica das docentes investigadas, 47% delas tem o terceiro grau completo e, 40% possuem apenas formação no magistério. No que se refere ao tema transversal saúde, 27% das professoras não realizaram estudos sobre o mesmo e, 40% das docentes não se sentiam preparadas para desenvolver esse conteúdo, apontando como principal fator limitante à falta de conhecimento mais profundo sobre saúde e a falta de material didático adequado. Sobre a importância em se trabalhar a saúde, 29% das respostas referiram-se aos cuidados com a saúde, e 20% em prevenir e conhecer doenças. Pode-se concluir que é necessária uma capacitação específica referente à temática em questão, o que deve ser acompanhada de políticas públicas que incentivem o profissional da educação e ofereça estrutura ao ambiente escolar"
